<?xml version="1.0" encoding="UTF-8"?>
<xs:schema xmlns:xs="http://www.w3.org/2001/XMLSchema" elementFormDefault="qualified" attributeFormDefault="unqualified">
	<xs:element name="Claims">
		<xs:complexType>
			<xs:sequence>
				<xs:element name="Claim" minOccurs="0" maxOccurs="unbounded">
					<xs:complexType>
						<xs:sequence>
							<xs:element name="currentDate" type="xs:string"/>
							<xs:element name="serviceDate" type="xs:string"/>
							<xs:element name="providerNumber">
								<xs:simpleType>
									<xs:restriction base="xs:string">
										<xs:length value="9"/>
									</xs:restriction>
								</xs:simpleType>
							</xs:element>
							<xs:element name="memberNumber">
								<xs:simpleType>
									<xs:restriction base="xs:string">
										<xs:length value="9"/>
									</xs:restriction>
								</xs:simpleType>
							</xs:element>
							<xs:element name="serviceCode">
								<xs:simpleType>
									<xs:restriction base="xs:string">
										<xs:length value="6"/>
									</xs:restriction>
								</xs:simpleType>
							</xs:element>
							<xs:element name="note">
							<xs:simpleType>
									<xs:restriction base="xs:string">
										<xs:maxLength value="100"/>
									</xs:restriction>
								</xs:simpleType>
							</xs:element>
						</xs:sequence>
					</xs:complexType>
				</xs:element>
			</xs:sequence>
		</xs:complexType>
	</xs:element>
</xs:schema>
